店舗,店舗名,郵便番号,地域,住所,営業時間,定休日,メニュー1,価格1,メニュー2,価格2,メニュー3,価格3,メニュー4,価格4,メニュー5,価格5,内容,備考,電話番号,座席数,駐車場台数,緯度,経度,画像URL1,画像URL2,画像URL3,画像URL4
40,ドライブイン　よしだ,919-1461,若狭,若狭町海山70-3,9:00～18:00,不定,イカ丼,"1,450",,,,,,,,,湖を眺めながら、当店オリジナルの丼ぶりをどうぞ。山芋、大葉、イカが特製醤油でそれぞれの味を主張させています。,,0770-47-1438,100,40,35.5846344,135.8676891,http://info.pref.fukui.jp/opendata/wakasaji/37-1.jpg,,,
41,洋食家がじゅまろ,917-0023,小浜,小浜市府中15-8,11:00～15:00、17:00～21:00,月,炙り若狭牛ドレスドオムライス風,"1,500",極旨洋風たれ若狭路丼～若狭牛と小浜サーモンの組み合わせ～,"1,500",,,,,,,極旨洋風たれ若狭路丼は、地元の食材、海の幸・里山の幸を洋食にアレンジ。贅沢にも小浜サーモンと若狭牛のコラボ！地元食材のワカメや野菜など地元「愛」が詰まったメニューになりました。がじゅまろ特製レモン生姜醤油でさっぱりと召し上がってください！,3日前までに要予約,0770-52-0408,26,30,35.494044,135.758367,http://info.pref.fukui.jp/opendata/wakasaji/041-1.jpg,,,
42,ホテル若杉,917-0077,小浜,小浜市駅前町7-16,11:00～13:30、17:30～21:00,,小浜三昧さば御膳,"2,700",満腹さば御膳,"1,500",サーモンムニエル御膳,"1,000",,,,,小浜三昧さば御膳は、焼きたての浜焼さばを生姜醤油で。ぐじ（甘鯛）の唐揚げも付いてボリューム満点です。満腹さば御膳は、生さばを1/2使用、お一人で2度おいしく小浜名物のさばを味わって頂けます。サーモンムニエル御膳は、分厚くカットしたサーモンをたっぷりのバターでふっくら香ばしく焼き上げました。,要予約（小浜三昧さば御膳）,0770-52-0900,45,20,35.4925535,135.7460536,http://info.pref.fukui.jp/opendata/wakasaji/53-1.jpg,http://info.pref.fukui.jp/opendata/wakasaji/53-2.jpg,http://info.pref.fukui.jp/opendata/wakasaji/53-3.jpg,
43,お食事処　みつや,917-0063,小浜,小浜市小浜酒井1-52,11:00～15:00、17:00～21:00,月,若狭路鯖定食,"1,150",,,,,,,,,小浜の名物、魚の旨味を引き立たせた「鯖の醤油干し」と、身もふっくらジューシーな「鯖の塩焼き」の食感の違いをお楽しみください。鯖の塩焼きのみの定食（860円）もございます。当店ではその他旬の魚料理、一品料理、定食、麺類、丼ものなど多種ご用意しております。,,0770-52-0239,28,3,35.4945114,135.7434559,http://info.pref.fukui.jp/opendata/wakasaji/42-1.jpg,,,
44,松月観の宿　いたや,917-0105,小浜,小浜市阿納10-4,11:00～15:00,不定（週1日）,ミニ懐石,"3,024",若狭ちらし海鮮丼,"1,500",,,,,,,昼間の喧騒を逃れ、のんびりと入浴しながら、ゆったりと流れる時をお楽しみください。ネタは7種で。旬の地魚を盛り込んだ海鮮丼です。小鉢、漬物、お吸い物が付きます。,,0770-54-3001,70,20,35.5345093,135.7853829,http://info.pref.fukui.jp/opendata/wakasaji/39-1.jpg,http://info.pref.fukui.jp/opendata/wakasaji/39-2.jpg,,
45,お食事処　はまがわ,917-0078,小浜,小浜市駅前町7-3,11:00～15:00、17:30～20:30,水,ぐじ若狭焼定食,"1,500",海鮮てんはま丼,"1,300",,,,,,,若狭の海の幸の王様、高級魚「若狭ぐじ」をさっと一汐して、丁寧に焼き上げました。素材のうまさをそのまま味わっていただけるリーズナブルな定食です。若狭小浜港で水揚げされた新鮮な魚と、若狭の名物鯖のへしこを、小浜産コシヒカリの上にてんこ盛りにした丼です。,,0770-52-0074,37,4,35.4925121,135.7456855,http://info.pref.fukui.jp/opendata/wakasaji/40-1.jpg,http://info.pref.fukui.jp/opendata/wakasaji/40-2.jpg,,
46,若狭マリンプラザ,917-0046,小浜,小浜市岡津44,10:00～19:30,,若狭御膳,"1,100",海鮮丼,"1,400",若狭御膳,"1,300",,,,,新鮮なお刺身と、焼き立てアツアツの鯖をお召し上がりください。米は地元のコシヒカリを使用。海鮮丼に使う醤油も地元で人気の甘みのあるものを使用。,,0770-53-2100,20,60,35.4817451,135.656138,http://info.pref.fukui.jp/opendata/wakasaji/41-1.jpg,http://info.pref.fukui.jp/opendata/wakasaji/41-2.jpg,http://info.pref.fukui.jp/opendata/wakasaji/41-3.jpg,
47,すし処　鮨富,917-0084,小浜,小浜市小浜広峰83-1,12:00～14:00、17:00～21:00,月,にぎりランチ,"2,500",海鮮ちらし（赤だし付）,"2,700",,,,,,,地産地消で頑張っています。米は福井県産コシヒカリ、錦糸卵は地鶏卵を使い、地魚とトロが主役の海鮮ちらしです。,,0770-53-0337,26,3,35.4972334,135.744109,http://info.pref.fukui.jp/opendata/wakasaji/43-1.jpg,http://info.pref.fukui.jp/opendata/wakasaji/43-2.jpg,,
48,ホテル　アーバンポート,917-0051,小浜,小浜市小浜白鳥72-1,11:30～14:00,,浜の宝石箱,"3,240",浜の宝丼,"1,944",,,,,,,小浜漁港より新鮮な海の幸をお届けします。開けてびっくりボリューム満点の海の幸丼と、名物の鯖寿し、焼き鯖寿しをご堪能ください。御食国若狭おばま自慢の海の幸を中心に、板長おすすめの素材を盛り込んだ逸品です。,,0770-53-2001,30,30,35.4938005,135.7378112,http://info.pref.fukui.jp/opendata/wakasaji/44-1.jpg,http://info.pref.fukui.jp/opendata/wakasaji/44-2.jpg,,
49,サンホテル　やまね,917-0069,小浜,小浜市小浜白鬚55-1,11:00～19:30,,旬彩プレート膳,"2,160",特製海鮮丼,"1,620",小浜サーモン五色膳,"1,500",,,,,四季折々の食材を板長おまかせの和定食でお召し上がりください。お料理の中身は時期によって変わります。新鮮な海の幸をさっぱりとした海鮮丼に仕上げました。豊かな海の恵みをお楽しみください。,要予約,0770-52-1450,30,40,35.4963424,135.739796,http://info.pref.fukui.jp/opendata/wakasaji/45-1.jpg,http://info.pref.fukui.jp/opendata/wakasaji/45-2.jpg,http://info.pref.fukui.jp/opendata/wakasaji/45-3.jpg,
50,生そば 米太,917-0065,小浜,小浜市小浜住吉9,11:00～19:00,水（祝日の場合は営業）、お盆、年始,後瀬山そば,"1,250",,,,,,,,,大根のしぼり汁で作ったツユで食べる「からみ」、地元産の自然薯をすりおろした「山里」、福井県ではおなじみの「おろし」、カツとおろしが絶妙な「カツおろし」の４種類の味をお楽しみいただけます。,,0770-52-0711,24,5,35.4932655,135.7393857,http://info.pref.fukui.jp/opendata/wakasaji/47-1.jpg,,,
51,四季の膳　ひいらぎ,917-0082,小浜,小浜市小浜津島17,12:00～13:30、17:00～22:30,日、年末年始,四季の旬彩膳,900,,,,,,,,,地元若狭おばまの四季折々の食材と自家製の野菜をたっぷり使い、心からの膳をご用意して皆様をお待ちしております。,,0770-52-6088,20～25,4,35.5000787,135.7441922,http://info.pref.fukui.jp/opendata/wakasaji/48-1.jpg,,,
52,いけす割烹　雅,917-0058,小浜,小浜市小浜香取107,11:30～22:00,火,海の幸定食,"3,024",若狭の漁師丼,"2,484",若狭小浜・今昔丼,"1,500",,,,,当店内の大きな生簀からすくい上げた鮮魚を目の前で大胆に調理し、若狭湾で獲れる旬の味覚を地産地消にて提供しています。和の空間の中、ゆったりとした気分で自然が育てた活魚の味をご賞味ください。地元の旬の魚、お寿司２貫、旬の小鉢、若狭ぐじ頭炙りの吸い物（漁の状況によりあら汁の場合あり）、漬物、ご飯　若狭湾で鍛えられた朝どれの新鮮な魚をたっぷりとのせちょっぴり贅沢にお寿司を盛り込んだ割烹雅らしい丼をお召し上がりください。,,0770-53-1678,120,15,35.4923505,135.7347213,http://info.pref.fukui.jp/opendata/wakasaji/46-1.jpg,http://info.pref.fukui.jp/opendata/wakasaji/46-2.jpg,http://info.pref.fukui.jp/opendata/wakasaji/46-3.jpg,
53,食彩　ごえん,917-0068,小浜,小浜市小浜日吉57-2,11:30～14:00、17:00～23:00,水,ごえん海鮮丼,"1,200",,,,,,,,,若狭湾を目の前に眺めながら、その日の朝に若狭湾で揚がった地魚料理をお気軽にお楽しみください。夏は岩がき、冬はカニやフグ料理もご用意できます。,,0770-53-0770,31,30,35.4951108,135.7387285,http://info.pref.fukui.jp/opendata/wakasaji/49-1.jpg,,,
54,ホテル　せくみ屋,917-0069,小浜,小浜市小浜白鬚113,11:30～14:30,,若狭虹会席,"5,400",,,,,,,,,ヤリイカの姿造りと刺身の盛り込み、ぐじの焼き物、カレイの唐揚げ、魚介の鍋、もずくの酢物　お刺身中心に、若狭路の名物を取りそろえた会席料理です。無料で入浴もサービスしております。（タオルはご持参ください。レンタルもあります）,要予約,0770-52-0020,50,100,35.4957921,135.7416736,http://info.pref.fukui.jp/opendata/wakasaji/50-1.jpg,,,
55,お食事処　魚山亭,917-0051,小浜,小浜市小浜白鳥27,11:00～14:30、17:00～22:00,月（祝日の場合は営業）,海鮮丼,"1,990",,,,,,,,,旬の魚を毎日仕入れて、新鮮でおいしい海鮮丼をご提供します。,,0770-52-6833,40,7,35.4933376,135.7372587,http://info.pref.fukui.jp/opendata/wakasaji/51-1.jpg,,,
56,中村商店,917-0093,小浜,小浜市水取1-5-6,12:00～15:00,不定,浜焼さば膳,"2,500",,,,,,,,,昔ながらのさっぱりとした伝統の味。当店の浜焼き鯖は焼き立てを提供します。,要予約,0770-53-2580,6,なし,35.5048061,135.7511767,http://info.pref.fukui.jp/opendata/wakasaji/52-1.jpg,,,
57,食遊ステーション　響,917-0081,小浜,小浜市川崎1-3-6,11:30～14:00、17:00～22:00,月,若狭ぐじ定食,"2,100",海鮮丼,"1,300",,,,,,,地元の旬の食材を使用し、お客様のニーズにお応えできる料理を提供いたします。若狭湾で獲れる新鮮な旬の地魚を使った、当店自慢の海鮮丼です。,,0770-64-5520,21,3,35.5043367,135.7351719,http://info.pref.fukui.jp/opendata/wakasaji/54-1.jpg,http://info.pref.fukui.jp/opendata/wakasaji/54-2.jpg,,
58,お食事処　宝来屋,917-0234,小浜,小浜市上野30-22-1,11:00～20:00,火,若狭膳,"1,500",海鮮変わり丼,"1,000",,,,,,,毎日、板長が市場まで足を運び、獲れたてのお魚を仕入れています。若狭おばまの旬の珍しい！美味しい！！を食べに来てください。地元でしか出回らないお魚を使った刺身丼です。最初は刺身丼で、お客様の好みで海鮮だし茶漬けへと２度お楽しみいただくこともできます。茶漬け用のだしは、魚の種類によって「白みそだし」か「かつおだし」。小鉢と漬物付き。,,0770-57-1119,30,6,35.4750439,135.7946848,http://info.pref.fukui.jp/opendata/wakasaji/55-1.jpg,http://info.pref.fukui.jp/opendata/wakasaji/55-2.jpg,,
59,お食事処　かねまつ,917-0078,小浜,小浜市大手町8-1大手ビル2Ｆ,11:30～14:00、17:00～20:30,,かねまつ丼,"1,200",てんはま丼,"1,500",,,,,,,地元の旬の魚をふんだんに使い、新鮮なお刺身がたっぷりの海鮮丼。あら汁はおかわり自由です。若狭湾で揚がる地魚が入った丼です。白いご飯の上にぶつ切りのお刺身、イカ、イクラ、甘えびなどをのせました。セットで付くアラ汁はおかわり自由です。,,0770-53-2559,67,6,35.4972127,135.7458699,http://info.pref.fukui.jp/opendata/wakasaji/56-1.jpg,http://info.pref.fukui.jp/opendata/wakasaji/56-2.jpg,,
60,若狭フィッシャーマンズ・ワーフ海幸苑,917-0081,小浜,小浜市川崎1-3-2,11:00～15:00,年末年始,潮風膳,"1,404",てんはま季節丼,"1,620",鯖遊膳,"1,404",,,,,四季折々の小浜湾を眺めながら、地元産の米、醸造酢を使用した鯖寿司をどうぞ。新鮮な若狭はぎ（かわはぎ）の丼を肝ぽん酢で。朝どれの若狭はぎ（かわはぎ）はふぐにも劣らない食感と味です。鯖遊膳は、自家製の鯖とねぎのぬた和えなど郷土のさば料理をふんだんに使用したふるさとの味をぜひご賞味ください。,,0770-52-3111,110,150,35.5001945,135.7400428,http://info.pref.fukui.jp/opendata/wakasaji/57-1.jpg,http://info.pref.fukui.jp/opendata/wakasaji/57-2.jpg,http://info.pref.fukui.jp/opendata/wakasaji/57-3.jpg,
61,お食事処　濱の四季,917-0081,小浜,小浜市川崎3-5,11:00～14:00（平日）、11:00～20:00（土日祝）,水、年末年始,御食国御膳,"1,890",,,,,,,,,若狭おばまの四季折々の旬の食材を使ったスローフードを、濱のかあちゃんたちが真心を込めて提供いたします。,,0770-53-0141,70,100,35.5006836,135.7371031,http://info.pref.fukui.jp/opendata/wakasaji/58-1.jpg,,,
62,寿司処　福芳,917-0078,小浜,小浜市大手町8-5,11:30～14:00、17:00～21:00,月、年末年始,若狭路海鮮ちらし膳,"1,944",海鮮ちらし,"1,500",寿司ランチ選べるケーキセット付き,"3,000～3,500",,,,,若狭の旬の魚に焼き鯖をあしらった名物ちらし寿司です。旬の魚を使ったちらしの「若狭路海鮮どんぶり」。旬の魚を使ったちらしと吸い物。新鮮な若狭の旬の魚が楽しめます。新鮮な若狭の魚の寿司セットに、カフェアルカンシェルの当日のケーキからお好みのケーキを選んでいただくケーキセット付き。,3メニューともに要予約,0770-53-2944,24,20,35.4976351,135.7459811,http://info.pref.fukui.jp/opendata/wakasaji/59-1.jpg,http://info.pref.fukui.jp/opendata/wakasaji/59-2.jpg,http://info.pref.fukui.jp/opendata/wakasaji/59-3.jpg,
63,若杉末広亭,917-0078,小浜,小浜市大手町8-5,11:00～14:00、17:00～20:00,不定、年末年始,鯖すき丼膳,"1,620",海鮮丼,"1,500",末広亭ランチ選べるケーキセット付き,"3,000",,,,,浜焼鯖をすき焼き風に煮込んだ郷土料理を丼にした手軽に食べていただける一品です。調理に時間がかかりますので、事前予約をいただけると早くお出しできます。新鮮な若狭の魚とへしこが楽しめます。漬物、お吸い物付き。その日の若狭のお魚を使った日替わりランチにカフェアルカンシェルの当日のケーキからお好みのケーキを選んでいただくケーキセット。,末広亭ランチ選べるケーキセット付きは要予約（当日でも可）,0770-53-0202,100,20,35.4976176,135.7459758,http://info.pref.fukui.jp/opendata/wakasaji/60-1.jpg,http://info.pref.fukui.jp/opendata/wakasaji/60-2.jpg,http://info.pref.fukui.jp/opendata/wakasaji/60-3.jpg,
64,若狭ふぐの宿　下亟,917-0105,小浜,小浜市阿納10-15,11:00～14:00,不定,若狭めで鯛御膳,"2,700",若狭贅沢めで鯛御膳,"3,564",若狭福ふぐランチ,"4,860",,,,,小浜市阿納地区は、若狭ふぐや鯛などの魚類養殖が盛んです。若狭の海で育ったトラフグやマダイは、身が引き締まって美味しさもひとしおです。自慢の若狭ふぐ・鯛料理を是非ご堪能ください。,要予約,0770-54-3313,40,20,35.534855,135.785325,http://info.pref.fukui.jp/opendata/wakasaji/61-73-1.jpg,http://info.pref.fukui.jp/opendata/wakasaji/61-73-2.jpg,http://info.pref.fukui.jp/opendata/wakasaji/61-73-3.jpg,
65,四季の宿　かわはら,917-0105,小浜,小浜市阿納11-8,11:00～15:00,不定,若狭めで鯛御膳,"2,700",若狭贅沢めで鯛御膳,"3,564",若狭福ふぐランチ,"4,860",,,,,小浜市阿納地区は、若狭ふぐや鯛などの魚類養殖が盛んです。若狭の海で育ったトラフグやマダイは、身が引き締まって美味しさもひとしおです。自慢の若狭ふぐ・鯛料理を是非ご堪能ください。,要予約,0770-54-3046,60,30,35.53434,135.785346,http://info.pref.fukui.jp/opendata/wakasaji/61-73-1.jpg,http://info.pref.fukui.jp/opendata/wakasaji/61-73-2.jpg,http://info.pref.fukui.jp/opendata/wakasaji/61-73-3.jpg,
66,中川,917-0105,小浜,小浜市阿納11-18,11:00～14:00,不定,若狭めで鯛御膳,"2,700",若狭贅沢めで鯛御膳,"3,564",若狭福ふぐランチ,"4,860",,,,,小浜市阿納地区は、若狭ふぐや鯛などの魚類養殖が盛んです。若狭の海で育ったトラフグやマダイは、身が引き締まって美味しさもひとしおです。自慢の若狭ふぐ・鯛料理を是非ご堪能ください。,要予約,0770-54-3311,20,10,35.534386,135.785115,http://info.pref.fukui.jp/opendata/wakasaji/61-73-1.jpg,http://info.pref.fukui.jp/opendata/wakasaji/61-73-2.jpg,http://info.pref.fukui.jp/opendata/wakasaji/61-73-3.jpg,
67,渚に建つ海鮮の宿　水月,917-0105,小浜,小浜市阿納12-34,12:00～14:20,不定,若狭めで鯛御膳,"2,700",若狭贅沢めで鯛御膳,"3,564",若狭福ふぐランチ,"4,860",,,,,小浜市阿納地区は、若狭ふぐや鯛などの魚類養殖が盛んです。若狭の海で育ったトラフグやマダイは、身が引き締まって美味しさもひとしおです。自慢の若狭ふぐ・鯛料理を是非ご堪能ください。,要予約,0770-54-3457,70,15,35.534763,35.534763,http://info.pref.fukui.jp/opendata/wakasaji/61-73-1.jpg,http://info.pref.fukui.jp/opendata/wakasaji/61-73-2.jpg,http://info.pref.fukui.jp/opendata/wakasaji/61-73-3.jpg,
68,四季の民宿　ひろた,917-0105,小浜,小浜市阿納9-1,12:00～14:00,不定,若狭めで鯛御膳,"2,700",若狭贅沢めで鯛御膳,"3,564",若狭福ふぐランチ,"4,860",,,,,小浜市阿納地区は、若狭ふぐや鯛などの魚類養殖が盛んです。若狭の海で育ったトラフグやマダイは、身が引き締まって美味しさもひとしおです。自慢の若狭ふぐ・鯛料理を是非ご堪能ください。,要予約,0770-54-3045,40,30,35.535167,135.785443,http://info.pref.fukui.jp/opendata/wakasaji/61-73-1.jpg,http://info.pref.fukui.jp/opendata/wakasaji/61-73-2.jpg,http://info.pref.fukui.jp/opendata/wakasaji/61-73-3.jpg,
69,グルメ民宿　はまもと,917-0105,小浜,小浜市阿納9-4,12:00～14:00,不定,若狭めで鯛御膳,"2,700",若狭贅沢めで鯛御膳,"3,564",若狭福ふぐランチ,"4,860",,,,,小浜市阿納地区は、若狭ふぐや鯛などの魚類養殖が盛んです。若狭の海で育ったトラフグやマダイは、身が引き締まって美味しさもひとしおです。自慢の若狭ふぐ・鯛料理を是非ご堪能ください。,要予約,0770-54-3043,50,20,35.53558,135.785435,http://info.pref.fukui.jp/opendata/wakasaji/61-73-1.jpg,http://info.pref.fukui.jp/opendata/wakasaji/61-73-2.jpg,http://info.pref.fukui.jp/opendata/wakasaji/61-73-3.jpg,
70,海の宿　ひこ荘,917-0105,小浜,小浜市阿納9-3,11:00～14:00,不定,若狭めで鯛御膳,"2,700",若狭贅沢めで鯛御膳,"3,564",若狭福ふぐランチ,"4,860",,,,,小浜市阿納地区は、若狭ふぐや鯛などの魚類養殖が盛んです。若狭の海で育ったトラフグやマダイは、身が引き締まって美味しさもひとしおです。自慢の若狭ふぐ・鯛料理を是非ご堪能ください。,要予約,0770-54-3315,20,10,35.535374,135.78545,http://info.pref.fukui.jp/opendata/wakasaji/61-73-1.jpg,http://info.pref.fukui.jp/opendata/wakasaji/61-73-2.jpg,http://info.pref.fukui.jp/opendata/wakasaji/61-73-3.jpg,
71,くつろぎの宿　浜頭,917-0105,小浜,小浜市阿納8-4,11:00～14:00,不定,若狭めで鯛御膳,"2,700",若狭贅沢めで鯛御膳,"3,564",若狭福ふぐランチ,"4,860",,,,,小浜市阿納地区は、若狭ふぐや鯛などの魚類養殖が盛んです。若狭の海で育ったトラフグやマダイは、身が引き締まって美味しさもひとしおです。自慢の若狭ふぐ・鯛料理を是非ご堪能ください。,要予約,0770-54-3047,40,20,35.535534,135.785208,http://info.pref.fukui.jp/opendata/wakasaji/61-73-1.jpg,http://info.pref.fukui.jp/opendata/wakasaji/61-73-2.jpg,http://info.pref.fukui.jp/opendata/wakasaji/61-73-3.jpg,
72,ふぐ料理の宿　さいば,917-0105,小浜,小浜市阿納12-73,11:00～14:00,不定,若狭めで鯛御膳,"2,700",若狭贅沢めで鯛御膳,"3,564",若狭福ふぐランチ,"4,860",,,,,小浜市阿納地区は、若狭ふぐや鯛などの魚類養殖が盛んです。若狭の海で育ったトラフグやマダイは、身が引き締まって美味しさもひとしおです。自慢の若狭ふぐ・鯛料理を是非ご堪能ください。,要予約,0770-54-3041,40,10,35.53478,135.785089,http://info.pref.fukui.jp/opendata/wakasaji/61-73-1.jpg,http://info.pref.fukui.jp/opendata/wakasaji/61-73-2.jpg,http://info.pref.fukui.jp/opendata/wakasaji/61-73-3.jpg,
73,まるいち旅館,917-0105,小浜,小浜市阿納11-12,12:00～14:00,不定,若狭めで鯛御膳,"2,700",若狭贅沢めで鯛御膳,"3,564",若狭福ふぐランチ,"4,860",,,,,小浜市阿納地区は、若狭ふぐや鯛などの魚類養殖が盛んです。若狭の海で育ったトラフグやマダイは、身が引き締まって美味しさもひとしおです。自慢の若狭ふぐ・鯛料理を是非ご堪能ください。,要予約,0770-54-3049,30,8,35.534626,135.785227,http://info.pref.fukui.jp/opendata/wakasaji/61-73-1.jpg,http://info.pref.fukui.jp/opendata/wakasaji/61-73-2.jpg,http://info.pref.fukui.jp/opendata/wakasaji/61-73-3.jpg,
74,いそべ,917-0105,小浜,小浜市阿納11-22,11:00～14:00,不定,若狭めで鯛御膳,"2,700",若狭贅沢めで鯛御膳,"3,564",若狭福ふぐランチ,"4,860",,,,,小浜市阿納地区は、若狭ふぐや鯛などの魚類養殖が盛んです。若狭の海で育ったトラフグやマダイは、身が引き締まって美味しさもひとしおです。自慢の若狭ふぐ・鯛料理を是非ご堪能ください。,要予約,0770-54-3314,25,20,35.5341,135.785094,http://info.pref.fukui.jp/opendata/wakasaji/61-73-1.jpg,http://info.pref.fukui.jp/opendata/wakasaji/61-73-2.jpg,http://info.pref.fukui.jp/opendata/wakasaji/61-73-3.jpg,
75,四季の香漂う宿　忠　広田,917-0105,小浜,小浜市阿納7-48,11:00～14:00,不定,若狭めで鯛御膳,"2,700",若狭贅沢めで鯛御膳,"3,564",若狭福ふぐランチ,"4,860",,,,,小浜市阿納地区は、若狭ふぐや鯛などの魚類養殖が盛んです。若狭の海で育ったトラフグやマダイは、身が引き締まって美味しさもひとしおです。自慢の若狭ふぐ・鯛料理を是非ご堪能ください。,要予約,0770-54-3310,30,15,35.535464,135.784843,http://info.pref.fukui.jp/opendata/wakasaji/61-73-1.jpg,http://info.pref.fukui.jp/opendata/wakasaji/61-73-2.jpg,http://info.pref.fukui.jp/opendata/wakasaji/61-73-3.jpg,
76,ふぐかに活魚料理民宿　まるふじ,917-0105,小浜,小浜市阿納9-12,11:00～14:00,不定,若狭めで鯛御膳,"2,700",若狭贅沢めで鯛御膳,"3,564",若狭福ふぐランチ,"4,860",,,,,小浜市阿納地区は、若狭ふぐや鯛などの魚類養殖が盛んです。若狭の海で育ったトラフグやマダイは、身が引き締まって美味しさもひとしおです。自慢の若狭ふぐ・鯛料理を是非ご堪能ください。,要予約,0770-54-3048,40,15,35.534011,135.782414,http://info.pref.fukui.jp/opendata/wakasaji/61-73-1.jpg,http://info.pref.fukui.jp/opendata/wakasaji/61-73-2.jpg,http://info.pref.fukui.jp/opendata/wakasaji/61-73-3.jpg,
77,やまと庵,917-0073,小浜,小浜市四谷町20-13,11:00～21:00,不定,鯖三昧定食,"1,180",サーモンの竜田揚げと揚げ野菜のトマト風（おこげ入り）定食,"1,080",,,,,,,鯖が苦手な方にも美味しく召し上がっていただける鯖料理。焼き鯖の竜田揚げと揚げ野菜をみそ、マヨネーズ、柑なんばで味付けしたソースで和えました。サラダ感覚で召し上がっていただけます。また、サーモンは子骨を抜いて二度揚げし、素揚げした野菜と一緒にトマトソースで味わっていただきます。,,0770-53-3450,70,,35.495992,135.749536,http://info.pref.fukui.jp/opendata/wakasaji/077-1.jpg,http://info.pref.fukui.jp/opendata/wakasaji/077-2.jpg,,
78,民宿佐助,917-0101,小浜,小浜市田烏36-47,12:00～14:00,,船場汁と地場産わかめと自家製へしこのおにぎり,"1,500",,,,,,,,,昔ながらのご当地の素朴な素材の味を、何とか現代の若者やへしこを知らない地域の方にも受け入れてもらうにはどういうメニューが良いかを考えました。おにぎりは、自分で作って体験しながら対話し食べていただきたいと思っています。皆さまのお越しをお待ちしています。,4名様以上、2日前までに要予約,0770-54-3407,10,4,35.537225,135.835329,http://info.pref.fukui.jp/opendata/wakasaji/078-1.jpg,,,
